{
  "schema_version": "1.0.0",
  "game_version": "0.1.0",
  "saved_at": "2026-09-27T10:15:00+07:00",
  "playtime_s": 734.5,
  "rng_seed": 20260927,
  "player": {
    "island_id": "isl_01_cu_lao",
    "position": [
      3.2,
      0.8,
      -12.5
    ],
    "yaw_deg": 145.0,
    "hp": 100,
    "money": 57,
    "last_tool_id": "tool_slipper"
  },
  "inventory": {
    "bag": [
      {
        "uid": "it_000014",
        "def_kind": "creature",
        "def_id": "cre_ca_ro",
        "variant_id": null,
        "base_value": 5,
        "trick_mult": 1.56,
        "cook_level": "raw",
        "flags": [],
        "created_at_s": 690.2
      },
      null,
      null
    ],
    "bait_counts": {
      "bait_worm": 3
    },
    "selected_bait_id": "bait_worm",
    "tools_owned": [
      "tool_hand",
      "tool_slipper"
    ],
    "rods_owned": [
      "rod_bamboo"
    ],
    "equipped_rod_id": "rod_bamboo",
    "equipped_id": "rod_bamboo",
    "upgrades": {
      "upg_backpack": 0,
      "upg_reel_speed": 0
    }
  },
  "world": {
    "items": [
      {
        "item": {
          "uid": "it_000015",
          "def_kind": "creature",
          "def_id": "cre_tep",
          "variant_id": null,
          "base_value": 2,
          "trick_mult": 1.3,
          "cook_level": "raw",
          "flags": [],
          "created_at_s": 720.0
        },
        "position": [
          4.0,
          0.9,
          -11.0
        ],
        "island_id": "isl_01_cu_lao"
      }
    ]
  },
  "progress": {
    "quests": {
      "quest_01_bua_trua": {
        "state": "active",
        "step_index": 1,
        "counts": {
          "step_deliver_ca_ro": 2
        }
      }
    },
    "bosses_defeated": [],
    "islands_unlocked": [
      "isl_01_cu_lao"
    ],
    "tutorial_done": [
      "cast",
      "reel",
      "smack",
      "pickup",
      "sell"
    ],
    "npc_flags": {
      "npc_co_ba": [
        "gift_given"
      ]
    }
  },
  "dex": {
    "species": {
      "cre_tep": {
        "caught": 4,
        "best_value": 3,
        "variants_seen": []
      },
      "cre_ca_ro": {
        "caught": 3,
        "best_value": 9,
        "variants_seen": []
      }
    },
    "tricks_seen": [
      "trick_air_smack",
      "trick_one_hit",
      "trick_head"
    ]
  }
}
